[
  {
    "document": "seven-layer-stack-paper",
    "evidence": "Allocation, budgeting, and anomaly detection",
    "from": {
      "slug": "seven-layer-stack-paper",
      "type": "document"
    },
    "official": true,
    "source_url": "https://www.tokeneconomics.com/projects/the-seven-layer-tokenomics-stack-paper/",
    "target": {
      "id": "allocation",
      "kind": "capability",
      "server": "framework",
      "uri": "finops://framework/capabilities/allocation"
    }
  },
  {
    "document": "seven-layer-stack-paper",
    "evidence": "Allocation, budgeting, and anomaly detection",
    "from": {
      "slug": "seven-layer-stack-paper",
      "type": "document"
    },
    "official": true,
    "source_url": "https://www.tokeneconomics.com/projects/the-seven-layer-tokenomics-stack-paper/",
    "target": {
      "id": "budgeting",
      "kind": "capability",
      "server": "framework",
      "uri": "finops://framework/capabilities/budgeting"
    }
  },
  {
    "document": "seven-layer-stack-paper",
    "evidence": "Allocation, budgeting, and anomaly detection",
    "from": {
      "slug": "seven-layer-stack-paper",
      "type": "document"
    },
    "official": true,
    "source_url": "https://www.tokeneconomics.com/projects/the-seven-layer-tokenomics-stack-paper/",
    "target": {
      "id": "anomaly-management",
      "kind": "capability",
      "server": "framework",
      "uri": "finops://framework/capabilities/anomaly-management"
    }
  },
  {
    "document": "big-t-notation-paper",
    "evidence": "anomaly detection on consumption spikes, and dashboards that make unit economics visible",
    "from": {
      "slug": "big-t-notation-paper",
      "type": "document"
    },
    "official": true,
    "source_url": "https://www.tokeneconomics.com/projects/big-t-notation-paper/",
    "target": {
      "id": "anomaly-management",
      "kind": "capability",
      "server": "framework",
      "uri": "finops://framework/capabilities/anomaly-management"
    }
  },
  {
    "document": "big-t-notation-paper",
    "evidence": "anomaly detection on consumption spikes, and dashboards that make unit economics visible",
    "from": {
      "slug": "big-t-notation-paper",
      "type": "document"
    },
    "official": true,
    "source_url": "https://www.tokeneconomics.com/projects/big-t-notation-paper/",
    "target": {
      "id": "unit-economics",
      "kind": "capability",
      "server": "framework",
      "uri": "finops://framework/capabilities/unit-economics"
    }
  },
  {
    "document": "big-t-notation",
    "evidence": "then visibility, then optimization, then unit economics",
    "from": {
      "slug": "big-t-notation",
      "type": "document"
    },
    "official": true,
    "source_url": "https://www.tokeneconomics.com/projects/big-t-notation/",
    "target": {
      "id": "unit-economics",
      "kind": "capability",
      "server": "framework",
      "uri": "finops://framework/capabilities/unit-economics"
    }
  },
  {
    "document": "personas-operating-model",
    "evidence": "Anomaly detection shifts from spend spikes to complexity shifts",
    "from": {
      "slug": "finops-practitioner",
      "type": "persona"
    },
    "official": true,
    "source_url": "https://www.tokeneconomics.com/projects/personas-and-operating-model-map/",
    "target": {
      "id": "anomaly-management",
      "kind": "capability",
      "server": "framework",
      "uri": "finops://framework/capabilities/anomaly-management"
    }
  },
  {
    "document": "personas-operating-model",
    "evidence": "Cost attribution and budgets | FinOps Practitioner",
    "from": {
      "slug": "finops-practitioner",
      "type": "persona"
    },
    "official": true,
    "source_url": "https://www.tokeneconomics.com/projects/personas-and-operating-model-map/",
    "target": {
      "id": "budgeting",
      "kind": "capability",
      "server": "framework",
      "uri": "finops://framework/capabilities/budgeting"
    }
  },
  {
    "document": "personas-operating-model",
    "evidence": "Forecasting and variance | FinOps Practitioner",
    "from": {
      "slug": "finops-practitioner",
      "type": "persona"
    },
    "official": true,
    "source_url": "https://www.tokeneconomics.com/projects/personas-and-operating-model-map/",
    "target": {
      "id": "forecasting",
      "kind": "capability",
      "server": "framework",
      "uri": "finops://framework/capabilities/forecasting"
    }
  },
  {
    "document": "personas-operating-model",
    "evidence": "forecasting for compounding demand",
    "from": {
      "slug": "finance",
      "type": "persona"
    },
    "official": true,
    "source_url": "https://www.tokeneconomics.com/projects/personas-and-operating-model-map/",
    "target": {
      "id": "forecasting",
      "kind": "capability",
      "server": "framework",
      "uri": "finops://framework/capabilities/forecasting"
    }
  },
  {
    "document": "focus-1-5-for-ai",
    "evidence": "cache hit rate for token-metered SKUs by model",
    "from": {
      "slug": "cache-hit-rate",
      "type": "metric"
    },
    "official": true,
    "source_url": "https://www.tokeneconomics.com/projects/what-1-5-does-for-ai-cost-and-what-it-does-not/",
    "target": {
      "id": "TokenCacheAction",
      "kind": "draft-identifier",
      "server": "focus-working-draft",
      "uri": null
    }
  },
  {
    "document": "focus-1-5-for-ai",
    "evidence": "The properties are ModelDeveloper, ModelFamily, ModelId, and ModelVersion.",
    "from": {
      "slug": "fr-2018",
      "type": "focus-item"
    },
    "official": true,
    "source_url": "https://www.tokeneconomics.com/projects/what-1-5-does-for-ai-cost-and-what-it-does-not/",
    "target": {
      "id": "ModelDeveloper",
      "kind": "draft-identifier",
      "server": "focus-working-draft",
      "uri": null
    }
  },
  {
    "document": "focus-1-5-for-ai",
    "evidence": "The properties are ModelDeveloper, ModelFamily, ModelId, and ModelVersion.",
    "from": {
      "slug": "fr-2018",
      "type": "focus-item"
    },
    "official": true,
    "source_url": "https://www.tokeneconomics.com/projects/what-1-5-does-for-ai-cost-and-what-it-does-not/",
    "target": {
      "id": "ModelFamily",
      "kind": "draft-identifier",
      "server": "focus-working-draft",
      "uri": null
    }
  },
  {
    "document": "focus-1-5-for-ai",
    "evidence": "The properties are ModelDeveloper, ModelFamily, ModelId, and ModelVersion.",
    "from": {
      "slug": "fr-2018",
      "type": "focus-item"
    },
    "official": true,
    "source_url": "https://www.tokeneconomics.com/projects/what-1-5-does-for-ai-cost-and-what-it-does-not/",
    "target": {
      "id": "ModelId",
      "kind": "draft-identifier",
      "server": "focus-working-draft",
      "uri": null
    }
  },
  {
    "document": "focus-1-5-for-ai",
    "evidence": "The properties are ModelDeveloper, ModelFamily, ModelId, and ModelVersion.",
    "from": {
      "slug": "fr-2018",
      "type": "focus-item"
    },
    "official": true,
    "source_url": "https://www.tokeneconomics.com/projects/what-1-5-does-for-ai-cost-and-what-it-does-not/",
    "target": {
      "id": "ModelVersion",
      "kind": "draft-identifier",
      "server": "focus-working-draft",
      "uri": null
    }
  },
  {
    "document": "focus-1-5-for-ai",
    "evidence": "Four recommended FOCUS-defined properties in SKU Price Details record the model behind a charge: the developer that created it, the model family, the model identifier as billed, and the version.",
    "from": {
      "slug": "fr-2018",
      "type": "focus-item"
    },
    "official": true,
    "source_url": "https://www.tokeneconomics.com/projects/what-1-5-does-for-ai-cost-and-what-it-does-not/",
    "target": {
      "id": "SkuPriceDetails",
      "kind": "column",
      "server": "focus",
      "uri": "focus://spec/1.2/columns/skupricedetails"
    }
  },
  {
    "document": "focus-1-5-for-ai",
    "evidence": "TokenCacheAction takes \"Uncached\", \"Read\", \"Write\", or \"Other\" on prices that meter only tokens consumed from a request.",
    "from": {
      "slug": "fr-2099",
      "type": "focus-item"
    },
    "official": true,
    "source_url": "https://www.tokeneconomics.com/projects/what-1-5-does-for-ai-cost-and-what-it-does-not/",
    "target": {
      "id": "TokenCacheAction",
      "kind": "draft-identifier",
      "server": "focus-working-draft",
      "uri": null
    }
  },
  {
    "document": "focus-1-5-for-ai",
    "evidence": "TokenDirection takes \"Input\" or \"Output\" on prices that meter tokens in one direction.",
    "from": {
      "slug": "fr-2099",
      "type": "focus-item"
    },
    "official": true,
    "source_url": "https://www.tokeneconomics.com/projects/what-1-5-does-for-ai-cost-and-what-it-does-not/",
    "target": {
      "id": "TokenDirection",
      "kind": "draft-identifier",
      "server": "focus-working-draft",
      "uri": null
    }
  },
  {
    "document": "focus-1-5-for-ai",
    "evidence": "They are the first FOCUS-defined SKU Price Details properties with a fixed set of allowed values.",
    "from": {
      "slug": "fr-2099",
      "type": "focus-item"
    },
    "official": true,
    "source_url": "https://www.tokeneconomics.com/projects/what-1-5-does-for-ai-cost-and-what-it-does-not/",
    "target": {
      "id": "SkuPriceDetails",
      "kind": "column",
      "server": "focus",
      "uri": "focus://spec/1.2/columns/skupricedetails"
    }
  },
  {
    "document": "focus-1-5-for-ai",
    "evidence": "Consumed Quantity and Consumed Unit carry the raw token count; Pricing Quantity and Pricing Unit carry the same consumption in the block the provider prices against, such as per million tokens.",
    "from": {
      "slug": "fr-1941",
      "type": "focus-item"
    },
    "official": true,
    "source_url": "https://www.tokeneconomics.com/projects/what-1-5-does-for-ai-cost-and-what-it-does-not/",
    "target": {